"id","question_text","company","date","interview_id"
"q4","Есть два стора в Redux как их объединить?","Altenar","2025-07-11","interview_Altenar_000"
"q5","Зачем нужен тип never? В чем отличие от void?","Altenar","2025-07-11","interview_Altenar_000"
"q6","Что такое оптимистический ответ на фронте?","Altenar","2025-07-11","interview_Altenar_000"
"q1","Где сейчас проживаете?","Altenar","2025-07-08","interview_Altenar_001"
"q2","Какие хобби?","Altenar","2025-07-08","interview_Altenar_001"
"q3","Как будете выбирать оффер из нескольких?","Altenar","2025-07-08","interview_Altenar_001"
"q4","Представьте что условия в оффере одинаковые, компании одинаковые, собес прошёл везде отлично. Как будете выбирать?","Altenar","2025-07-08","interview_Altenar_001"
"q5","Собираетесь ли переезжать?","Altenar","2025-07-08","interview_Altenar_001"
"q6","Как относитесь к посещению офиса 2 раза в неделю?","Altenar","2025-07-08","interview_Altenar_001"
"q7","Как вы оцените свой уровень как разработчика? Почему не сеньор?","Altenar","2025-07-08","interview_Altenar_001"
"q8","Как развиваетесь в свободное время?","Altenar","2025-07-08","interview_Altenar_001"
"q1","Как для тебя выглядит налаженный процесс постановки задачи?","Altenar","2025-07-08","interview_Altenar_002"
"q2","Как была построена работа с аналитиками и дизайнерами?","Altenar","2025-07-08","interview_Altenar_002"
"q3","Бывало такое что что-то шло не так в коммуникации, что-то не учли где-то?","Altenar","2025-07-08","interview_Altenar_002"
"q4","Работал с zustand или valtio?","Altenar","2025-07-08","interview_Altenar_002"
"q5","Почему именно эти библиотеки были выбраны при решении задачи?","Altenar","2025-07-08","interview_Altenar_002"
"q6","Расскажи как у вас был построен процесс внедрения новых библиотек, кто принимал решение за их внедрение?","Altenar","2025-07-08","interview_Altenar_002"
"q7","Расскажи про свой самый большой факап на работе?","Altenar","2025-07-08","interview_Altenar_002"
"q8","Что в свободное время делаешь?","Altenar","2025-07-08","interview_Altenar_002"
"q9","Как относишься к мату?","Altenar","2025-07-08","interview_Altenar_002"
"q10","Какой лучший мем по твоему мнению на данный момент?","Altenar","2025-07-08","interview_Altenar_002"
"q1","Как распределялись задачи на спринт?","Altenar","2025-06-28","interview_Altenar_003"
"q2","Как внутри команды договаривались о внедрении новой технологии или библиотеки?","Altenar","2025-06-28","interview_Altenar_003"
"q3","Были ли моменты, когда твоё решение или решение команды по внедрению технологий не нравилось, и как это решали?","Altenar","2025-06-28","interview_Altenar_003"
"q4","Какой у тебя был уровень в команде?","Altenar","2025-06-28","interview_Altenar_003"
"q5","Какие есть подходы управления состоянием в React и в каких случаях лучше использовать каждый из них?","Altenar","2025-06-28","interview_Altenar_003"
"q6","Чем отличается концепция Redux и MobX?","Altenar","2025-06-28","interview_Altenar_003"
"q7","Как бы ты организовывал работу с большим стором в React с использованием слайсов?","Altenar","2025-06-28","interview_Altenar_003"
"q8","Как работают слайсы в Redux и могут ли они общаться друг с другом?","Altenar","2025-06-28","interview_Altenar_003"
"q9","Можем ли мы как-то передать информацию между слайсами в Redux?","Altenar","2025-06-28","interview_Altenar_003"
"q10","Как создать несколько инстансов одного Redux стора, чтобы изолировать их, например, засунуть в контекст?","Altenar","2025-06-28","interview_Altenar_003"
"q11","Рефакторинг React-приложения с использованием TypeScript","Altenar","2025-06-28","interview_Altenar_003"
"q1","Как пришел в IT","AmoCRM","2025-07-16","interview_AmoCRM_000"
"q2","Чем хочешь заниматься сейчас","AmoCRM","2025-07-16","interview_AmoCRM_000"
"q3","Какое для себя видишь развитие","AmoCRM","2025-07-16","interview_AmoCRM_000"
"q4","Почему меняешь работу","AmoCRM","2025-07-16","interview_AmoCRM_000"
"q5","Предметные вопросы про опыт","AmoCRM","2025-07-16","interview_AmoCRM_000"
"q6","У тебя есть бандл, твоя задача его оптимизировать (только js). Сборка приложения происходит на webpack","AmoCRM","2025-07-16","interview_AmoCRM_000"
"q7","У тебя есть проект с более чем 10 разделами с разной бизнес логикой, у проекта нет автоматического тестирования. Что ты будешь делать, чтобы исправить это","AmoCRM","2025-07-16","interview_AmoCRM_000"
"q8","Напишите функцию, которая генерирует случайный цвет в формате HEX (#ffffff)","AmoCRM","2025-07-16","interview_AmoCRM_000"
"q9","Напишите функцию генерации случайного цвета в формате HEX в одну строку","AmoCRM","2025-07-16","interview_AmoCRM_000"
"q10","Напишите метод, который генерирует случайный 4-х значный код от 0000 до 9999, при этом каждый вызов должен возвращать новый, неповторяющийся код, а после использования всех кодов метод должен обнулить счетчик","AmoCRM","2025-07-16","interview_AmoCRM_000"
"q11","Какие еще возможные решения задачи генерации неповторяющегося 4-х значного кода от 0000 до 9999 с обнулением после исчерпания всех кодов","AmoCRM","2025-07-16","interview_AmoCRM_000"
"q1","Сколько нужно было апрувов для пуша в фичи в ветку","AmoCRM","2025-07-07","interview_AmoCRM_001"
"q2","Какие линтеры и форматировщики использовали","AmoCRM","2025-07-07","interview_AmoCRM_001"
"q3","Как отсматриваете свои фичи и как кто смотрит","AmoCRM","2025-07-07","interview_AmoCRM_001"
"q4","useEffect синхронный или асинхронный?","AmoCRM","2025-07-07","interview_AmoCRM_001"
"q5","Какие жизненные циклы реализует useEffect","AmoCRM","2025-07-07","interview_AmoCRM_001"
"q6","Для чего нужна cleanup функция в useEffect","AmoCRM","2025-07-07","interview_AmoCRM_001"
"q7","Для чего используется key в React","AmoCRM","2025-07-07","interview_AmoCRM_001"
"q8","Что используешь для key в React","AmoCRM","2025-07-07","interview_AmoCRM_001"
"q9","Расскажи про Flux всё, что знаешь","AmoCRM","2025-07-07","interview_AmoCRM_001"
"q10","Расскажи про event loop всё, что знаешь","AmoCRM","2025-07-07","interview_AmoCRM_001"
"q11","Написать функцию генерации случайного hex цвета, возвращающую строку вида #xxxxxx с шестью символами от 0 до f","AmoCRM","2025-07-07","interview_AmoCRM_001"
"q12","Реализовать функцию groupDataBySkill, которая группирует массив объектов по полю skill, возвращая объект с ключами-скиллами и значениями-массивами объектов с этим скиллом","AmoCRM","2025-07-07","interview_AmoCRM_001"
"q1","В целом отдаешь предпочтение готовым решениям или сам изобретаешь велосипед?","AmoCRM","2025-06-17","interview_AmoCRM_002"
"q2","На перфоманс проверяете, когда затаскиваете новую библиотеку?","AmoCRM","2025-06-17","interview_AmoCRM_002"
"q3","Как проводили код ревью? На что обращали внимание?","AmoCRM","2025-06-17","interview_AmoCRM_002"
"q4","Сколько по времени тратили на просмотр кода на ревью?","AmoCRM","2025-06-17","interview_AmoCRM_002"
"q5","Почему выбирают React, а не нативный JavaScript? Какие преимущества дает эта библиотека? И что ты знаешь о методах оптимизации в React?","AmoCRM","2025-06-17","interview_AmoCRM_002"
"q6","Хук useEffect. В какой момент он срабатывает? Для чего используется? Можем ли мы подписываться на какие-то события в браузере?","AmoCRM","2025-06-17","interview_AmoCRM_002"
"q7","Как реализована функция очистки (clean up) в useEffect?","AmoCRM","2025-06-17","interview_AmoCRM_002"
"q8","Для чего могут использоваться keys в React? Как их правильно задавать?","AmoCRM","2025-06-17","interview_AmoCRM_002"
"q9","В чем недостаток использования Math.random() для генерации keys в React?","AmoCRM","2025-06-17","interview_AmoCRM_002"
"q10","С какими стейт менеджерами работал?","AmoCRM","2025-06-17","interview_AmoCRM_002"
"q11","Расскажи, что такое flux архитектура? Как работает цикл внутри flux?","AmoCRM","2025-06-17","interview_AmoCRM_002"
"q12","Сталкивался ли с дженериками в TypeScript? Что это и для чего использовать?","AmoCRM","2025-06-17","interview_AmoCRM_002"
"q13","Какие utility types в TypeScript знаешь? С какими сталкивался в работе? Что они делают?","AmoCRM","2025-06-17","interview_AmoCRM_002"
"q14","Расскажи про EventLoop в JavaScript","AmoCRM","2025-06-17","interview_AmoCRM_002"
"q1","Напишите функцию, которая генерирует случайный цвет в формате HEX (#ffffff) с использованием генератора случайных кодов с предзаполненным и перемешанным стеком значений","AmoCRM","2025-06-17","interview_AmoCRM_002"
"q2","Определите порядок вывода чисел в консоль для данного асинхронного кода с setTimeout и Promise","AmoCRM","2025-06-17","interview_AmoCRM_002"
"q1","Реализуйте функцию generateRandomHexColor, которая генерирует случайный HEX цвет в формате #xxxxxx","AmoCRM","2025-06-03","interview_AmoCRM_003"
"q2","Напишите метод getCode, который генерирует случайный 4-х значный код от 0000 до 9999, при этом каждый вызов должен возвращать новый неповторяющийся код, а после использования всех кодов счетчик должен обнуляться","AmoCRM","2025-06-03","interview_AmoCRM_003"
"q3","Определите порядок вывода чисел в консоль при выполнении вложенных setTimeout и Promise с учетом event-loop","AmoCRM","2025-06-03","interview_AmoCRM_003"
"q4","Как можно улучшить функцию groupDataBySkill, которая группирует массив объектов по полю skill, используя reduce и учитывая обработку ошибок при асинхронном получении данных","AmoCRM","2025-06-03","interview_AmoCRM_003"
"q1","Расскажи про свои сложные задачи","Angie","2024-11-22","interview_Angie_000"
"q2","Представь что возникла ошибка на странице в UI например, как бы ты решал эту проблему? Например ошибка в внешней библиотеке, как бы ты решал в этом случае проблему?","Angie","2024-11-22","interview_Angie_000"
"q3","Что такое JavaScript?","Angie","2024-11-22","interview_Angie_000"
"q4","JS интерпретируемый или компилируемый ЯП?","Angie","2024-11-22","interview_Angie_000"
"q5","В чем отличие интерпретируемого ЯП от компилируемого?","Angie","2024-11-22","interview_Angie_000"
"q6","Что из последнего читал из новостей статей о технологиях, что возможно использовал в работе","Angie","2024-11-22","interview_Angie_000"
"q7","Что такое ECMAScript?","Angie","2024-11-22","interview_Angie_000"
"q8","Что такое CORS? Как настроить CORS?","Angie","2024-11-22","interview_Angie_000"
"q9","Как работает JS в браузере? С помощью чего он работает там?","Angie","2024-11-22","interview_Angie_000"
"q10","Как работает EventLoop?","Angie","2024-11-22","interview_Angie_000"
"q11","Что такое стек вызовов и как он работает?","Angie","2024-11-22","interview_Angie_000"
"q12","В чем отличие var, let, const?","Angie","2024-11-22","interview_Angie_000"
"q13","Что такое this и как работает?","Angie","2024-11-22","interview_Angie_000"
"q14","Какие хранилища данных ты знаешь в браузере и в чем их отличие? Назови различия между localStorage и cookies в сценариях использования.","Angie","2024-11-22","interview_Angie_000"
"q15","Из чего состоит HTTP запрос?","Angie","2024-11-22","interview_Angie_000"
"q16","Что такое заголовки в HTTP запросе, их правила, зачем они нужны, и почему мы не можем просто передавать заголовки в body например?","Angie","2024-11-22","interview_Angie_000"
"q17","Как сделать так чтобы при нажатии на ссылку у нас скачивался файл? А теперь как сделать так, чтобы при переходе по урлу у нас сразу скачивался файл?","Angie","2024-11-22","interview_Angie_000"
"q18","Что такое browser object model и что туда входит?","Angie","2024-11-22","interview_Angie_000"
"q1","Определи что выведется в консоль в функции logContext и исправь код так, чтобы выводился контекст 'inner obj'","Angie","2024-11-22","interview_Angie_000"
"q2","Отрефакторь React-компонент Users с использованием useState и useEffect, исправь ошибки в обработке формы и запросах fetch","Angie","2024-11-22","interview_Angie_000"
"q3","Определи порядок вывода в консоль для кода с setTimeout, Promise и console.log","Angie","2024-11-22","interview_Angie_000"
"q1","По твоему опыту, с какими ограничениями реакта столкнулся? Во что упирается производительность?","Argo Studio","2025-05-28","interview_Argo_Studio_000"
"q2","Как решать проблему с SEO оптимизацией реакта?","Argo Studio","2025-05-28","interview_Argo_Studio_000"
"q3","Расскажи про virtual dom, как вообще это работает (reconciliation, эвристический алгоритм, сравнение узлов)?","Argo Studio","2025-05-28","interview_Argo_Studio_000"
"q4","А к чему может привести поведение, при котором старый дом сразу же удаляется, если элементы разные (эвристический алгоритм)?","Argo Studio","2025-05-28","interview_Argo_Studio_000"
"q5","Расскажи про key в реакте?","Argo Studio","2025-05-28","interview_Argo_Studio_000"
"q6","Спрашивает про глубокую работу браузера, как отрисовывает страницу реакт. Глубже чем Critical Render Path (архитектура Chromium)","Argo Studio","2025-05-28","interview_Argo_Studio_000"
"q7","Расскажи что такое Critical render path?","Argo Studio","2025-05-28","interview_Argo_Studio_000"
"q8","visibility: hidden / display: none отличия. Какие стадии отрисовки страницы затрагивают?","Argo Studio","2025-05-28","interview_Argo_Studio_000"
"q9","Какие ещё css правила затрагивают изменение layout?","Argo Studio","2025-05-28","interview_Argo_Studio_000"
"q10","Использовал ли какие-то сложные конструкции Typescript?","Argo Studio","2025-05-28","interview_Argo_Studio_000"
"q11","Приведи пример использования дженериков. Как бы ты типизировал компонент какой-нибудь, который может разный тип на вход принимать","Argo Studio","2025-05-28","interview_Argo_Studio_000"
"q12","Был ли опыт настройки линтеров, конфигов?","Argo Studio","2025-05-28","interview_Argo_Studio_000"
"q13","Был ли опыт создания своих npm-пакетов?","Argo Studio","2025-05-28","interview_Argo_Studio_000"
"q14","Расскажи подробно как редачили npm пакеты, где хранили и тд","Argo Studio","2025-05-28","interview_Argo_Studio_000"
"q15","Какими свойствами должен обладать хороший unit-тест?","Argo Studio","2025-05-28","interview_Argo_Studio_000"
"q16","Есть процентная метрика покрытия unit тестами проекта. Как думаешь, насколько эта метрика вообще полезна?","Argo Studio","2025-05-28","interview_Argo_Studio_000"
"q17","В каких случаях покрытие тестами может только навредить разработке? Не ускорить, а замедлить?","Argo Studio","2025-05-28","interview_Argo_Studio_000"
"q18","По какому флоу разработки работали в команде? (Git Flow)","Argo Studio","2025-05-28","interview_Argo_Studio_000"
"q19","Знаешь что такое trunk based development?","Argo Studio","2025-05-28","interview_Argo_Studio_000"
"q20","Какая у вас архитектура на проекте? Знаком с FSD?","Argo Studio","2025-05-28","interview_Argo_Studio_000"
"q21","Типизируй компонент Select с использованием дженериков, чтобы он мог принимать разные типы значения в зависимости от режима работы (single или multi)","Argo Studio","2025-05-28","interview_Argo_Studio_000"
"q1","var/let/const","ATI.su","2025-02-17","interview_ATI.su_000"
"q2","Что ещё хостится в JavaScript и почему (function declaration)","ATI.su","2025-02-17","interview_ATI.su_000"
"q3","Объясните прототипное наследование в JavaScript","ATI.su","2025-02-17","interview_ATI.su_000"
"q4","Для чего нужны классы в JavaScript","ATI.su","2025-02-17","interview_ATI.su_000"
"q5","Объясните асинхронность в JavaScript, как работает RequestAnimationFrame, и как работают промисы","ATI.su","2025-02-17","interview_ATI.su_000"
"q6","Как браузер парсит страницу","ATI.su","2025-02-17","interview_ATI.su_000"
"q7","Что самое дешёвое для анимации в браузере (transform) и как часто RequestAnimationFrame будет запускаться","ATI.su","2025-02-17","interview_ATI.su_000"
"q8","Зачем нужен TypeScript и React, в чём их преимущества","ATI.su","2025-02-17","interview_ATI.su_000"
"q9","Объясните контекст в React","ATI.su","2025-02-17","interview_ATI.su_000"
"q10","Стоит ли выносить статический список за пределы компонента или в отдельный компонент","ATI.su","2025-02-17","interview_ATI.su_000"
"q11","Как работает Redux, в чём его отличие от других стейт-менеджеров","ATI.su","2025-02-17","interview_ATI.su_000"
"q12","Что такое микрофронты и как они работают","ATI.su","2025-02-17","interview_ATI.su_000"
"q13","Вопросы по работе с webpack","ATI.su","2025-02-17","interview_ATI.su_000"
"q14","Какие виды уязвимостей XSS, CORS, CSRF вы знаете и как бы их исправляли","ATI.su","2025-02-17","interview_ATI.su_000"