"id","question_text","company","date","interview_id"
"q1","Типы свойства display и их разница","Lofty","2024-06-07","interview_Lofty_000"
"q2","Специфичность и селектор с нулевой специфичностью","Lofty","2024-06-07","interview_Lofty_000"
"q3","Способы организации css в проекте","Lofty","2024-06-07","interview_Lofty_000"
"q4","Стандартные вопросы про асинхронность","Lofty","2024-06-07","interview_Lofty_000"
"q5","Решить задачу valid parentheses с LeetCode","Lofty","2024-06-07","interview_Lofty_000"
"q6","requestAnimationFrame","Lofty","2024-06-07","interview_Lofty_000"
"q7","Критический путь рендеринга веб страницы","Lofty","2024-06-07","interview_Lofty_000"
"q8","Отличия Vuex и Pinia и что больше нравится","Lofty","2024-06-07","interview_Lofty_000"
