"id","question_text","company","date","interview_id"
"q1","Про прошлый опыт в резюме. С чем работал?","Код Открытия","2025-01-31","interview_Код_Открытия_000"
"q2","В чем преимущество тех технологий, которые использовали?","Код Открытия","2025-01-31","interview_Код_Открытия_000"
"q3","Почему FSD? Расскажи про паттерны FSD?","Код Открытия","2025-01-31","interview_Код_Открытия_000"
"q4","ООП основные принципы? Рассказать и пересечение паттернов FSD и ООП","Код Открытия","2025-01-31","interview_Код_Открытия_000"
"q5","Почему Zustand лучше подходит для FSD?","Код Открытия","2025-01-31","interview_Код_Открытия_000"
