"id","question_text","company","date","interview_id"
"q1","Как создать кастомный хук в React","Centicore Solutions На Проект Go Invest","2024-06-20","interview_Centicore_Solutions_На_Проект_Go_Invest_000"
"q2","Какова сложность алгоритма пузырьковой сортировки","Centicore Solutions На Проект Go Invest","2024-06-20","interview_Centicore_Solutions_На_Проект_Go_Invest_000"
"q3","Как передаются куки с клиента на сервер","Centicore Solutions На Проект Go Invest","2024-06-20","interview_Centicore_Solutions_На_Проект_Go_Invest_000"
"q4","Что такое CORS и для чего он используется","Centicore Solutions На Проект Go Invest","2024-06-20","interview_Centicore_Solutions_На_Проект_Go_Invest_000"
"q5","Какой самый эффективный способ глубокого клонирования объектов в JavaScript","Centicore Solutions На Проект Go Invest","2024-06-20","interview_Centicore_Solutions_На_Проект_Go_Invest_000"
