"id","question_text","company","date","interview_id"
"q1","Какую архитектуру используешь на проекте, какие знаешь?","Crtex","2024-02-08","interview_Crtex_000"
"q2","Что такое функциональное программирование?","Crtex","2024-02-08","interview_Crtex_000"
"q3","В какой парадигме пишут на JS?","Crtex","2024-02-08","interview_Crtex_000"
"q4","Что такое браузер и зачем он нужен?","Crtex","2024-02-08","interview_Crtex_000"
"q5","Что такое EventLoop?","Crtex","2024-02-08","interview_Crtex_000"
"q6","Как работает async await?","Crtex","2024-02-08","interview_Crtex_000"
"q7","Какие существуют способы оптимизации?","Crtex","2024-02-08","interview_Crtex_000"
"q8","Что такое мемоизация и почему она не всегда нужна?","Crtex","2024-02-08","interview_Crtex_000"
"q1","Реализуйте функцию myFlat, которая принимает вложенный массив с файлами и папками и возвращает плоский массив путей к файлам с правильным префиксом, например: входные данные const data = [ 'index.ts', { src: [ 'index.ts', { ui: [ 'index.ts', { cards: ['cards.tsx', 'index.ts'], wallets: ['index.ts', 'all-wallets.tsx'] } ] } ] } ]; результат должен быть [ 'index.ts', 'src/index.ts', 'src/ui/index.ts', 'src/ui/cards/cards.tsx', 'src/ui/cards/index.ts', 'src/ui/wallets/index.ts', 'src/ui/wallets/all-wallets.tsx' ]","Crtex","2024-02-08","interview_Crtex_000"
