"id","question_text","company","date","interview_id"
"q1","Чем отличаются фреймворки?","Infinet Wireless","2024-03-24","interview_Infinet_Wireless_000"
"q2","Объясните основные принципы ООП","Infinet Wireless","2024-03-24","interview_Infinet_Wireless_000"
"q3","Какие протоколы вы знаете и в каких случаях их используете?","Infinet Wireless","2024-03-24","interview_Infinet_Wireless_000"
"q4","Какие тесты вы пишете и почему?","Infinet Wireless","2024-03-24","interview_Infinet_Wireless_000"
"q5","Что такое gRPC и как вы его используете?","Infinet Wireless","2024-03-24","interview_Infinet_Wireless_000"
"q6","Какие команды Linux вы используете чаще всего и для чего?","Infinet Wireless","2024-03-24","interview_Infinet_Wireless_000"
