"id","question_text","company","date","interview_id"
"q1","Объясните порядок вывода в консоль для кода с setTimeout, Promise и console.log: setTimeout(() => console.log('1'), 0); console.log('2'); Promise.resolve().then(() => console.log('3')).then(console.log('4')).catch(() => console.log('5')); setTimeout(() => console.log('6'), 0); console.log('7');","Альфа Лизинг","2024-08-25","interview_Альфа_Лизинг_000"
"q2","Объясните поведение области видимости в коде с var и функциями в цикле while, почему console.log(a[0]()) и console.log(a[1]()) возвращают -1, и как отрефакторить код с использованием let или IIFE для правильного захвата значения i","Альфа Лизинг","2024-08-25","interview_Альфа_Лизинг_000"
"q4","Что происходит, когда пользователь вводит название сайта в адресную строку браузера?","Альфа Лизинг","2024-08-25","interview_Альфа_Лизинг_000"
"q5","Назовите и опишите основные принципы объектно-ориентированного программирования (ООП)","Альфа Лизинг","2024-08-25","interview_Альфа_Лизинг_000"
"q6","Назовите и опишите основные принципы работы Redux","Альфа Лизинг","2024-08-25","interview_Альфа_Лизинг_000"
"q7","Реализуйте React-компонент с кнопкой, которая увеличивает значение счетчика; начальное значение счетчика приходит через пропс и может изменяться через пропс; значение счетчика отображается в span; при размонтировании компонента значение счетчика отправляется на фиктивный API один раз; задача — минимизировать количество ререндеров","Альфа Лизинг","2024-08-25","interview_Альфа_Лизинг_000"
