"id","question_text","company","date","interview_id"
"q1","как была устроена разработка?","Промышленные инновации","2024-10-25","interview_Промышленные_инновации_000"
"q2","какой был процесс разработки, сколько членов в команде?","Промышленные инновации","2024-10-25","interview_Промышленные_инновации_000"
"q3","Что делал в последней компании на проекте?","Промышленные инновации","2024-10-25","interview_Промышленные_инновации_000"
"q4","Что делал в первой компании на проекте, как был устроен процесс разработки там и сколько человек в команде?","Промышленные инновации","2024-10-25","interview_Промышленные_инновации_000"
"q5","Как себя вижу через несколько лет?","Промышленные инновации","2024-10-25","interview_Промышленные_инновации_000"
"q6","Готов ли к офисному формату работы?","Промышленные инновации","2024-10-25","interview_Промышленные_инновации_000"
