"id","question_text","company","date","interview_id"
"q1","Рассказать про опыт работы, какие было сложные задачи","Сател","2025-07-11","interview_Сател_000"
"q2","Рассказать про Redux: какие у меня плюсы и минусы","Сател","2025-07-11","interview_Сател_000"
"q3","Рассказать про RTK Query","Сател","2025-07-11","interview_Сател_000"
"q4","Рассказать как бы написал код для обработки протухшего токена с использованием interception","Сател","2025-07-11","interview_Сател_000"
"q5","Какие есть способы оптимизировать загрузку страницы, если она долго загружается","Сател","2025-07-11","interview_Сател_000"
"q6","Какие существуют способы общения бэка с фронтом, включая Http, WebSocket и Polling","Сател","2025-07-11","interview_Сател_000"
"q7","Рассказать для чего нужен WebSocket и как организовать его работу","Сател","2025-07-11","interview_Сател_000"
