"id","question_text","company","date","interview_id"
"q5","Напишите приложение слот-машины (однорукий бандит), где при дергании ручки вращаются числа","Т-Банк","2024-10-15","interview_Т-Банк_023"
"q1","Дан массив, нужно его разрезать так, чтобы сумма правой и левой части были равны. Вернуть левую сумму","Т-Банк","2024-10-11","interview_Т-Банк_024"
"q2","Решить задачу с LeetCode: permutation in string","Т-Банк","2024-10-11","interview_Т-Банк_024"
"q3","Дан массив домов houses, где число — это этаж дома, и цель — индекс нужного дома. Нужно найти минимальную длину лестницы, с которой можно дойти до нужного дома. Для решения нужно итерироваться с индекса target вправо и влево, при каждой итерации вычислять корректный минимум","Т-Банк","2024-10-11","interview_Т-Банк_024"
"q1","Можно ли обратиться к переменным типа var/let/const за пределами функции?","Т-Банк","2024-10-08","interview_Т-Банк_025"
"q2","В чем разница между let и const?","Т-Банк","2024-10-08","interview_Т-Банк_025"
"q3","В чем разница между == и ===?","Т-Банк","2024-10-08","interview_Т-Банк_025"
"q4","Что возвращает функция по умолчанию?","Т-Банк","2024-10-08","interview_Т-Банк_025"
"q5","Как можно клонировать объект в JavaScript?","Т-Банк","2024-10-08","interview_Т-Банк_025"
"q6","Какой тип данных возвращает fetch?","Т-Банк","2024-10-08","interview_Т-Банк_025"
"q7","Что выполнится раньше Promise или setTimeout?","Т-Банк","2024-10-08","interview_Т-Банк_025"
"q8","Что возвращает setTimeout?","Т-Банк","2024-10-08","interview_Т-Банк_025"
"q9","Зачем нужен Symbol?","Т-Банк","2024-10-08","interview_Т-Банк_025"
"q10","Что такое Мар?","Т-Банк","2024-10-08","interview_Т-Банк_025"
"q11","В чем разница между bind и call?","Т-Банк","2024-10-08","interview_Т-Банк_025"
"q12","Какие есть этапы у event?","Т-Банк","2024-10-08","interview_Т-Банк_025"
"q13","В чем разница между margin и padding?","Т-Банк","2024-10-08","interview_Т-Банк_025"
"q14","Как можно отцентровать элемент?","Т-Банк","2024-10-08","interview_Т-Банк_025"
"q15","Что приоритетнее id или class?","Т-Банк","2024-10-08","interview_Т-Банк_025"
"q1","Что выведет и почему следующий код: console.log(1); setTimeout(function() { console.log(2) }); Promise.resolve(3).then(console.log); console.log(1); setTimeout(function() { console.log(5) }, 0); console.log(6);","Т-Банк","2024-10-08","interview_Т-Банк_026"
"q2","Что будет если к предыдущему коду добавить функцию foo1, которая рекурсивно вызывает себя через Promise.resolve().then(foo1), и вызвать foo1()","Т-Банк","2024-10-08","interview_Т-Банк_026"
"q3","Что будет если к предыдущему коду добавить функцию foo2, которая рекурсивно вызывает себя через setTimeout, и вызвать foo2()","Т-Банк","2024-10-08","interview_Т-Банк_026"
"q4","Написать свой EventEmitter и проверку для него","Т-Банк","2024-10-08","interview_Т-Банк_026"
"q5","Написать свою реализацию Promise.all и функции проверки для неё","Т-Банк","2024-10-08","interview_Т-Банк_026"
"q6","Почему не появляется инпут после нажатия на кнопку, если реф с фокусом ставится до рендера самого инпута, и как решить эту проблему 3-4 способами","Т-Банк","2024-10-08","interview_Т-Банк_026"
"q7","Написать приложение по API Рика и Морти с поиском и обработкой ошибок","Т-Банк","2024-10-08","interview_Т-Банк_026"
"q8","Добавить в приложение по API Рика и Морти дебаунс для поиска","Т-Банк","2024-10-08","interview_Т-Банк_026"
"q9","Написать кастомный React-хук, который содержит код с запросами к API Рика и Морти, с булевым hasNextPage и функцией fetchMore, которая добавляет еще страницу к текущим персонажам","Т-Банк","2024-10-08","interview_Т-Банк_026"
"q10","Как оборвать запрос с помощью AbortController","Т-Банк","2024-10-08","interview_Т-Банк_026"
"q1","Что выйдет в консоль лог в каком порядке и почему при выполнении кода с console.log, setTimeout и Promise.resolve","Т-Банк","2024-10-01","interview_Т-Банк_027"
"q2","Что выйдет в консоль лог в каком порядке и почему при выполнении кода с console.log, setTimeout, Promise.resolve и созданием нового Promise с асинхронным resolve","Т-Банк","2024-10-01","interview_Т-Банк_027"
"q3","Что выйдет в консоль лог и почему при рекурсивном вызове функции, возвращающей Promise, и при рекурсивном вызове функции с setTimeout, а также какими способами можно пофиксить бесконечный вызов","Т-Банк","2024-10-01","interview_Т-Банк_027"
"q4","В каком порядке выведутся консоль логи в React-компонентах с использованием useEffect, useRef и forwardRef, и на каком элементе будет фокус при первом рендере","Т-Банк","2024-10-01","interview_Т-Банк_027"
"q1","Рассказать о себе","Т-Банк","2024-09-26","interview_Т-Банк_029"
"q1","Проектируем мессенджер, 1 в 1 как в указанном примере","Т-Банк","2024-09-24","interview_Т-Банк_030"
"q1","Есть двумерный массив, заполненный целыми числами 1,2,3... как панель домофона (слева направо, сверху вниз). На вход функции подаётся массив чисел (пароль), которые есть в этом массиве. Нужно определить, за сколько ходов можно пройти по всем числам пароля, переходя между ними по координатам массива","Т-Банк","2024-09-23","interview_Т-Банк_031"
"q2","Дана задача с массива целых чисел: найти подмассив с максимальной суммой, при этом в подмассиве не более 2 уникальных чисел","Т-Банк","2024-09-23","interview_Т-Банк_031"
"q1","event emitter","Т-Банк","2024-09-19","interview_Т-Банк_032"
"q2","Реализуйте функцию promise any","Т-Банк","2024-09-19","interview_Т-Банк_032"
"q3","Реализуйте функцию deepCopy для глубокого клонирования объектов","Т-Банк","2024-09-19","interview_Т-Банк_032"
"q4","Проанализируйте причины перерендеров в React и предложите способы их оптимизации","Т-Банк","2024-09-19","interview_Т-Банк_032"
"q5","Напишите небольшое приложение на React по API Рика и Морти с отображением списка персонажей, поиском по имени, пагинацией, состояниями ошибки и загрузки","Т-Банк","2024-09-19","interview_Т-Банк_032"
"q1","Как проектировать верхнеуровневый дизайн системы","Т-Банк","2024-09-02","interview_Т-Банк_033"
"q2","Объясните принципы load balancing и как правильно его использовать в архитектуре систем","Т-Банк","2024-09-02","interview_Т-Банк_033"
"q3","Что такое НФТ в контексте системного дизайна и как учитывать их при проектировании","Т-Банк","2024-09-02","interview_Т-Банк_033"
"q1","Нужно написать функцию, которая проверяет является ли строка подпоследовательностью названия файла","Т-Банк","2024-08-29","interview_Т-Банк_034"
"q2","Найти индексы самого длинного неотсортированного подмассива в массиве чисел","Т-Банк","2024-08-29","interview_Т-Банк_034"
"q1","Реализуйте алгоритмическую задачу Two Sum: найти две цифры в массиве, сумма которых равна заданному числу","Т-Банк","2024-08-27","interview_Т-Банк_035"
"q2","Реализуйте алгоритмическую задачу Find All Numbers Disappeared in an Array: найти все отсутствующие числа в массиве в диапазоне от 1 до n","Т-Банк","2024-08-27","interview_Т-Банк_035"
"q1","Написать функцию promiseAny, которая принимает массив промисов и возвращает первый успешно выполненный промис или AggregateError, если все промисы отклонены","Т-Банк","2024-06-14","interview_Т-Банк_036"
"q2","Отрефакторить React код","Т-Банк","2024-06-14","interview_Т-Банк_036"
"q2","Promise задача: определить что выводится в консоль при обработке асинхронного кода","Т-Банк","2024-02-07","interview_Т-Банк_037"
"q3","Задача на замыкание: написать функцию runOnce которая выполняется только один раз","Т-Банк","2024-02-07","interview_Т-Банк_037"
"q1","Рассказать про себя","Т-Банк","2024-02-05","interview_Т-Банк_038"
"q2","Расскажи про свой опыт работы","Т-Банк","2024-02-05","interview_Т-Банк_038"
"q3","Задай вопросы про продукт компании","Т-Банк","2024-02-05","interview_Т-Банк_038"
"q1","Какие бывают типы требований: Функциональные Требования (ФТ) и Нефункциональные (НФТ)","Т-Банк","2024-01-31","interview_Т-Банк_039"
"q2","Что такое CDN и как он работает","Т-Банк","2024-01-31","interview_Т-Банк_039"
"q3","Что такое load balancing и как он реализуется","Т-Банк","2024-01-31","interview_Т-Банк_039"
"q4","Чем отличаются реляционные и нереляционные базы данных","Т-Банк","2024-01-31","interview_Т-Банк_039"
"q5","Построить архитектуру мессенджера с учетом фронтовой части","Т-Банк","2024-01-31","interview_Т-Банк_039"
"q1","Реализуйте функцию getMax, которая находит длину максимальной подстроки без повторяющихся символов в заданной строке","Т-Банк","2024-01-19","interview_Т-Банк_040"
"q2","Реализуйте функцию IDESearch, которая проверяет, содержится ли подстрока в строке filename как последовательность символов в порядке следования","Т-Банк","2024-01-19","interview_Т-Банк_040"
"q1","Реализовать класс EventEmitter с методами on для подписки на событие, off для отписки и emit для оповещения о событии","Т-Банк","2024-01-13","interview_Т-Банк_041"
"q2","Реализовать функцию promiseAny, которая принимает массив промисов и возвращает первый успешно выполненный промис или ошибку, если все промисы отклонены","Т-Банк","2024-01-13","interview_Т-Банк_041"
"q3","Задачка на event loop","Т-Банк","2024-01-13","interview_Т-Банк_041"
"q4","В React вывести список героев, сделав запрос на бекенд, и реализовать debounce для input","Т-Банк","2024-01-13","interview_Т-Банк_041"
"q1","За функцией можно ли достать let var и const переменные, объявленные в рамках функции?","Т-Банк","2024-01-09","interview_Т-Банк_042"
"q2","Как можно клонировать объект?","Т-Банк","2024-01-09","interview_Т-Банк_042"
"q3","Какой тип возвращает fetch?","Т-Банк","2024-01-09","interview_Т-Банк_042"
"q4","Объясните разницу между == и ===","Т-Банк","2024-01-09","interview_Т-Банк_042"
"q5","Что такое new Map и что там может храниться?","Т-Банк","2024-01-09","interview_Т-Банк_042"
"q6","Что по умолчанию возвращает функция?","Т-Банк","2024-01-09","interview_Т-Банк_042"
"q7","Объясните разницу между let и const","Т-Банк","2024-01-09","interview_Т-Банк_042"
"q8","Объясните разницу между bind и apply","Т-Банк","2024-01-09","interview_Т-Банк_042"
"q9","Что раньше выполнится: промис или setTimeout?","Т-Банк","2024-01-09","interview_Т-Банк_042"
"q10","Что возвращает setTimeout и зачем он это возвращает?","Т-Банк","2024-01-09","interview_Т-Банк_042"
