"id","question_text","company","date","interview_id"
"q1","Даны два отсортированных по возрастанию массива целых чисел arr1 и arr2. Напишите функцию, которая возвращает массив элементов, присутствующих только в одном из массивов (симметрическую разность). Входные массивы уже отсортированы по возрастанию. Результат должен быть отсортирован по возрастанию. Дубликаты в пределах одного массива должны быть сохранены. Не используйте дополнительные структуры данных (Set, Map и т.д.)","Т-Банк","2025-07-10","interview_Т-Банк_000"
"q2","Дан массив интервалов stream, где каждый интервал представляет время подключения и отключения одного зрителя в формате [start, end]. Необходимо определить максимальное количество зрителей, которые одновременно находились в стриме. Входные данные: массив пар чисел [[start1, end1], [start2, end2], ...]. Все времена - целые неотрицательные числа. Интервалы считаются включительно (зритель активен в момент start и end). Если один зритель отключается в момент t, а другой подключается в тот же момент t, сначала учитываем отключение","Т-Банк","2025-07-10","interview_Т-Банк_000"
"q1","Написать функцию deepCopy, которая рекурсивно копирует объекты и массивы, возвращая примитивы как есть","Т-Банк","2025-07-08","interview_Т-Банк_001"
"q2","Написать функцию memo, которая реализует мемоизацию для переданной функции с использованием Map и JSON.stringify для ключей","Т-Банк","2025-07-08","interview_Т-Банк_001"
"q3","Задачка на перерендер компонентов","Т-Банк","2025-07-08","interview_Т-Банк_001"
"q4","Задачки на Рика и Морти","Т-Банк","2025-07-08","interview_Т-Банк_001"
"q1","Почему нельзя передавать в ключи объекта что-то кроме string или number?","Т-Банк","2025-07-06","interview_Т-Банк_002"
"q2","Что произойдет, если передать в emit.on({}, () => {})? Объясните, почему event запишется по ключу objectObject.","Т-Банк","2025-07-06","interview_Т-Банк_002"
"q3","Что произойдет, если передать в emit.on('toString', () => {})? Объясните, почему перезапишется toString и при попытке его использования дефолтного поведения не будет.","Т-Банк","2025-07-06","interview_Т-Банк_002"
"q4","Почему для избежания конфликтов с ключами объекта лучше использовать Map в this.events?","Т-Банк","2025-07-06","interview_Т-Банк_002"
"q5","Напишите реализацию event emitter с использованием Map для хранения событий.","Т-Банк","2025-07-06","interview_Т-Банк_002"
"q6","Напишите функцию promisify, которая преобразует функцию с колбэком в функцию, возвращающую Promise.","Т-Банк","2025-07-06","interview_Т-Банк_002"
"q7","Задача на Rick и Morty (описание задачи отсутствует, требуется уточнение).","Т-Банк","2025-07-06","interview_Т-Банк_002"
"q1","Написать класс EventEmitter с методами on(eventName, callback) для подписки, off(eventName, callback) для отписки и emit(eventName, data) для оповещения подписчиков","Т-Банк","2025-06-26","interview_Т-Банк_003"
"q2","Реализовать функцию promiseAll(promises), которая принимает массив промисов и возвращает промис, резолвящийся массивом результатов всех промисов или реджектящийся при ошибке любого из них","Т-Банк","2025-06-26","interview_Т-Банк_003"
"q3","Объяснить причины и способы оптимизации перерендеров в React","Т-Банк","2025-06-26","interview_Т-Банк_003"
"q1","Реализовать EventEmitter с методами on, off, emit, которые поддерживают чейнинг и не допускают повторного добавления одинаковых обработчиков","Т-Банк","2025-06-16","interview_Т-Банк_004"
"q2","Рассказать про работу event-loop и особенности работы requestAnimationFrame","Т-Банк","2025-06-16","interview_Т-Банк_004"
"q3","Написать функцию мемоизации с возможностью очистить кэш","Т-Банк","2025-06-16","interview_Т-Банк_004"
"q4","Реализовать React-приложение для поиска героев Рик и Морти с использованием API, поддержкой пагинации, обработкой ошибок и индикатором загрузки","Т-Банк","2025-06-16","interview_Т-Банк_004"
"q1","Что такое event-loop","Т-Банк","2025-06-11","interview_Т-Банк_005"
"q2","Что такое замыкания","Т-Банк","2025-06-11","interview_Т-Банк_005"
"q1","Что выведет следующий код и как исправить ошибку с контекстом this в методе getFilteredUsers объекта userService?","Т-Банк","2025-05-21","interview_Т-Банк_007"
"q2","Что выведет следующий код с console.log и setTimeout/Promise, и каково будет поведение на странице?","Т-Банк","2025-05-21","interview_Т-Банк_007"
"q3","Каково поведение функции infiniteMicrotask, которая рекурсивно вызывает Promise.resolve().then(infiniteMicrotask)?","Т-Банк","2025-05-21","interview_Т-Банк_007"
"q4","Каково поведение функции infiniteMacrotask, которая рекурсивно вызывает setTimeout(infiniteMacrotask, 0)?","Т-Банк","2025-05-21","interview_Т-Банк_007"
"q5","Реализовать класс EventEmitter с методами on, off, once, emit, listenerCount и listeners согласно описанию","Т-Банк","2025-05-21","interview_Т-Банк_007"
"q6","Что произойдет при ререндере родительского компонента, если в нем есть 3 вложенных компонента?","Т-Банк","2025-05-21","interview_Т-Банк_007"
"q7","Что произойдет при ререндере дочернего компонента после ввода текста в input, и как избежать ререндера дочернего компонента?","Т-Банк","2025-05-21","interview_Т-Банк_007"
"q8","Реализовать функционал отображения списка и поиска через input с использованием debounce и асинхронного запроса к API","Т-Банк","2025-05-21","interview_Т-Банк_007"
"q1","Дан массив натуральных чисел. Требуется проверить, можно ли в нём выбрать четыре различных элемента x, y, z, w так, чтобы x + y = z + w, при этом элементы считаются различными, если индексы всех элементов уникальны. Если это возможно - вывести индексы этих элементов","Т-Банк","2025-05-12","interview_Т-Банк_008"
"q2","Какие есть интересные кейсы для задачи с выбором четырёх элементов массива, сумма которых равна, которые нужно прописать и протестировать?","Т-Банк","2025-05-12","interview_Т-Банк_008"
"q3","Какова временная и пространственная сложность решения задачи с выбором четырёх элементов массива, сумма которых равна?","Т-Банк","2025-05-12","interview_Т-Банк_008"
"q4","На вход подаётся непустая строка. Необходимо вернуть самый длинный палиндром в данной строке","Т-Банк","2025-05-12","interview_Т-Банк_008"
"q5","Какова временная сложность задачи поиска самого длинного палиндрома в строке?","Т-Банк","2025-05-12","interview_Т-Банк_008"
"q6","Как сократить временную сложность задачи поиска самого длинного палиндрома хотя бы до O(n²)?","Т-Банк","2025-05-12","interview_Т-Банк_008"
"q1","Реализуйте функцию debounce с настраиваемой задержкой","Т-Банк","2025-04-30","interview_Т-Банк_009"
"q2","Решить проблему с гонкой промисов при использовании API, используя AbortController для остановки предыдущих вызовов","Т-Банк","2025-04-30","interview_Т-Банк_009"
"q1","В чем проблема в методе getOnlineUsers и какие есть способы исправить?","Т-Банк","2025-04-28","interview_Т-Банк_010"
"q2","Чем отличается стрелочная функция от обычной функции в контексте this?","Т-Банк","2025-04-28","interview_Т-Банк_010"
"q3","Можно ли корректно вынести коллбэк метода filter в отдельную переменную, которая будет хранить эту функцию-коллбэк, и в каком виде?","Т-Банк","2025-04-28","interview_Т-Банк_010"
"q4","Как добиться ошибки при выполнении функции с использованием директивы 'use strict' и почему она возникает?","Т-Банк","2025-04-28","interview_Т-Банк_010"
"q5","Что такое this в JavaScript?","Т-Банк","2025-04-28","interview_Т-Банк_010"
"q6","Реализовать класс EventEmitter с методами on, off, emit, которые поддерживают цепочку вызовов, при этом обработчики не должны повторяться.","Т-Банк","2025-04-28","interview_Т-Банк_010"
"q7","Объяснить поведение event-loop на примере кода с setTimeout, Promise.then и синхронным кодом, включая переполнение стека микрозадачами и порядок выполнения макро- и микрозадач.","Т-Банк","2025-04-28","interview_Т-Банк_010"
"q8","Что такое event-loop?","Т-Банк","2025-04-28","interview_Т-Банк_010"
"q9","Создать React-приложение для поиска персонажей по API https://rickandmortyapi.com/api/character?name=rick с полем ввода, запросом данных по вводу текста, отображением списка имен, индикацией загрузки, обработкой ошибки 404, дебаунсом и пагинацией.","Т-Банк","2025-04-28","interview_Т-Банк_010"
"q1","Оптимально объединить два массива [112, 1, 4, 10] и [32, 12, 68, 12, 1] в один отсортированный по возрастанию массив","Т-Банк","2025-04-28","interview_Т-Банк_011"
"q2","Что такое O-нотация? Как оценивается временная сложность алгоритма? Что такое пространственная сложность и как ее оценивать?","Т-Банк","2025-04-28","interview_Т-Банк_011"
"q3","Реализовать функцию, которая принимает массив координат объектов вида [{x, y}] и определяет наличие оси симметрии по оси Y, не учитывая в первой итерации, что ось симметрии может иметь дробную координату X","Т-Банк","2025-04-28","interview_Т-Банк_011"
"q1","Как узнать, что в переменной хранится функция?","Т-Банк","2025-04-21","interview_Т-Банк_012"
"q2","Что такое CORS?","Т-Банк","2025-04-21","interview_Т-Банк_012"
"q3","Чем отличаются sessionStorage от cookie?","Т-Банк","2025-04-21","interview_Т-Банк_012"
"q4","Как узнать, что в переменной хранится массив?","Т-Банк","2025-04-21","interview_Т-Банк_012"
"q5","Дан массив из 3 элементов, сколько будет элементов, если добавить элемент по индексу 7?","Т-Банк","2025-04-21","interview_Т-Банк_012"
"q6","Что приводит к ререндеру компонентов в React?","Т-Банк","2025-04-21","interview_Т-Банк_012"
"q7","Как изменить состояние компонента?","Т-Банк","2025-04-21","interview_Т-Банк_012"
"q8","Как запустить веб-приложение внутри другого веб-приложения?","Т-Банк","2025-04-21","interview_Т-Банк_012"
"q9","Если конфликтная ситуация с коллегой, как будешь решать?","Т-Банк","2025-04-21","interview_Т-Банк_012"
"q10","Какое качество тебе помогает справляться с большой нагрузкой и решением конфликтных ситуаций?","Т-Банк","2025-04-21","interview_Т-Банк_012"
"q11","Что у тебя есть из дополнительного в опыте: митапы, выступления на конференциях, статьи?","Т-Банк","2025-04-21","interview_Т-Банк_012"
"q12","У тебя есть опыт предложения своих решений и как ты их продвигал, как предлагал?","Т-Банк","2025-04-21","interview_Т-Банк_012"
"q13","В чем ты хотел развиваться дальше? Кем себя видишь в дальнейшем?","Т-Банк","2025-04-21","interview_Т-Банк_012"
"q14","Почему ищешь работу сейчас?","Т-Банк","2025-04-21","interview_Т-Банк_012"
"q15","Сколько бы ты дней мог ходить в офис?","Т-Банк","2025-04-21","interview_Т-Банк_012"
"q1","event-loop","Т-Банк","2025-03-27","interview_Т-Банк_013"
"q1","Приводит ли типы оператор ===","Т-Банк","2025-02-06","interview_Т-Банк_015"
"q2","Если переменная объявлена через var, let, const есть ли доступ к ней снаружи функции","Т-Банк","2025-02-06","interview_Т-Банк_015"
"q3","Как клонировать объект малым количеством кода","Т-Банк","2025-02-06","interview_Т-Банк_015"
"q4","Чему равен результат выполнения функции, если нет оператора return","Т-Банк","2025-02-06","interview_Т-Банк_015"
"q5","Какая область видимости у переменной, объявленной через let","Т-Банк","2025-02-06","interview_Т-Банк_015"
"q6","Отличие bind от apply","Т-Банк","2025-02-06","interview_Т-Банк_015"
"q7","Что коллекция Map может использовать в качестве ключей","Т-Банк","2025-02-06","interview_Т-Банк_015"
"q8","Что выполнится раньше: Promise.resolve или setTimeout","Т-Банк","2025-02-06","interview_Т-Банк_015"
"q9","Как подписаться на одно событие DOM элемента несколькими обработчиками","Т-Банк","2025-02-06","interview_Т-Банк_015"
"q10","Отличие let от const","Т-Банк","2025-02-06","interview_Т-Банк_015"
"q11","Что возвращает setTimeout","Т-Банк","2025-02-06","interview_Т-Банк_015"
"q12","Какой тип возвращаемого значения функции fetch","Т-Банк","2025-02-06","interview_Т-Банк_015"
"q13","Что делает instanceof","Т-Банк","2025-02-06","interview_Т-Банк_015"
"q1","Опишите архитектуру веб-мессенджера с компонентным дизайном на фронтенде","Т-Банк","2025-02-04","interview_Т-Банк_016"
"q2","Составьте HLD-схему для веб-мессенджера","Т-Банк","2025-02-04","interview_Т-Банк_016"
"q3","Какие API-запросы необходимо реализовать для мессенджера, например, получить сообщения, отправить сообщение, и какие аргументы они принимают","Т-Банк","2025-02-04","interview_Т-Банк_016"
"q4","Опишите интерфейс сообщения и пользователя в мессенджере","Т-Банк","2025-02-04","interview_Т-Банк_016"
"q5","Рассмотрите вопросы производительности веб-мессенджера с использованием Web Vitals и Lighthouse","Т-Банк","2025-02-04","interview_Т-Банк_016"
"q6","Опишите меры безопасности для веб-мессенджера, включая защиту от XSS-атак, использование JWT, httpOnly и secure флагов","Т-Банк","2025-02-04","interview_Т-Банк_016"
"q7","Обсудите возможные челленджи при горизонтальном и вертикальном масштабировании веб-мессенджера","Т-Банк","2025-02-04","interview_Т-Банк_016"
"q8","Уточните и распишите требования к NFT в контексте веб-мессенджера","Т-Банк","2025-02-04","interview_Т-Банк_016"
"q1","Реализуйте функцию minCost(A, K, X), которая минимизирует общую стоимость товаров с учетом использования K купонов, каждый из которых уменьшает цену самого дорогого товара на X, и возвращает суммарную стоимость после применения купонов","Т-Банк","2025-01-30","interview_Т-Банк_017"
"q2","Реализуйте функцию printUnion(arr1, arr2), которая принимает два отсортированных массива и выводит уникальные элементы из их объединения без дубликатов","Т-Банк","2025-01-30","interview_Т-Банк_017"
"q1","Написать Event emitter","Т-Банк","2025-01-28","interview_Т-Банк_018"
"q2","Event loop что будет в консоли?","Т-Банк","2025-01-28","interview_Т-Банк_018"
"q3","Задача на анализ перерендеров и их оптимизация с использованием React.memo, React.useCallback, React.useMemo","Т-Банк","2025-01-28","interview_Т-Банк_018"
"q4","Написать небольшое приложение по API Рика и Морти с отображением списка персонажей, поиском по имени, пагинацией, состоянием ошибки и загрузки","Т-Банк","2025-01-28","interview_Т-Банк_018"
"q1","Написать EventEmitter","Т-Банк","2024-11-05","interview_Т-Банк_020"
"q2","Реализовать кастомный PromiseAll","Т-Банк","2024-11-05","interview_Т-Банк_020"
"q3","Объяснить, какие компоненты будут ререндериться и почему","Т-Банк","2024-11-05","interview_Т-Банк_020"
"q4","Создать приложение с использованием API Rick & Morty для поиска персонажей по имени с одним полем ввода, запросом данных по вводу текста, отображением списка результатов, индикацией загрузки и обработкой ошибки 404 при отсутствии персонажа","Т-Банк","2024-11-05","interview_Т-Банк_020"
"q1","Определите порядок вывода в консоль для кода с console.log, setTimeout и Promise.resolve, включая модификации с рекурсивным вызовом Promise и setTimeout","Т-Банк","2024-10-29","interview_Т-Банк_021"
"q2","Что выведет следующий код с объектом userService и методом getFilteredUsers, где внутри filter используется обычная функция, и как правильно забиндить контекст для корректной работы метода?","Т-Банк","2024-10-29","interview_Т-Банк_021"
"q3","Реализуйте собственную версию функции promiseAll, которая принимает массив промисов и возвращает промис, резолвящийся массивом результатов всех входящих промисов","Т-Банк","2024-10-29","interview_Т-Банк_021"
"q4","Объясните, почему в React-приложении при нажатии на кнопку не происходит фокус на появляющемся инпуте, и предложите варианты решения проблемы с использованием useRef и useState","Т-Банк","2024-10-29","interview_Т-Банк_021"
"q5","Задача из предыдущих собеседований про Рика и Морти","Т-Банк","2024-10-29","interview_Т-Банк_021"
"q1","Опишите архитектурный подход к проектированию масштабируемой системы с учетом отказоустойчивости и высокой нагрузки","Т-Банк","2024-10-18","interview_Т-Банк_022"
"q2","Рассмотрите способы обеспечения консистентности данных в распределенной системе","Т-Банк","2024-10-18","interview_Т-Банк_022"
"q3","Опишите методы балансировки нагрузки между сервисами в микросервисной архитектуре","Т-Банк","2024-10-18","interview_Т-Банк_022"
"q4","Какие паттерны проектирования вы бы использовали для построения отказоустойчивой системы и почему","Т-Банк","2024-10-18","interview_Т-Банк_022"
"q5","Объясните, как реализовать систему логирования и мониторинга для крупного проекта","Т-Банк","2024-10-18","interview_Т-Банк_022"
"q6","Опишите подходы к масштабированию базы данных в высоконагруженных системах","Т-Банк","2024-10-18","interview_Т-Банк_022"
"q7","Как обеспечить безопасность и защиту данных в распределенной архитектуре","Т-Банк","2024-10-18","interview_Т-Банк_022"
"q1","Реализуйте функцию глубокого копирования объекта с учетом всех тестовых случаев","Т-Банк","2024-10-15","interview_Т-Банк_023"
"q2","Реализуйте функцию Promise.any с правильным учетом счетчиков и обработки асинхронности","Т-Банк","2024-10-15","interview_Т-Банк_023"
"q3","Объясните, какие React-компоненты перерисуются при изменении состояния и почему","Т-Банк","2024-10-15","interview_Т-Банк_023"
"q4","Опишите, как работает механизм перерисовки компонентов в React и как можно оптимизировать рендеринг","Т-Банк","2024-10-15","interview_Т-Банк_023"
